"Status","Start Time","Stop Time","Duration in ms","Parent Suite","Suite","Sub Suite","Test Class","Test Method","Name","Description"
"passed","Tue Aug 09 13:33:32 UTC 2022","Tue Aug 09 13:33:36 UTC 2022","3699","","tests/redmine.spec.js","Search feature with valid credentials  ","","","Fill in ""Search"" field: ""wiki""",""
"passed","Tue Aug 09 13:33:45 UTC 2022","Tue Aug 09 13:33:49 UTC 2022","4852","","tests/redmine.spec.js","Sighn in","","","Filling   inputs fields",""
"passed","Tue Aug 09 13:33:39 UTC 2022","Tue Aug 09 13:33:45 UTC 2022","5797","","tests/redmine.spec.js","Password recovery","","","Submiting to recover password",""
"passed","Fri Aug 05 14:30:45 UTC 2022","Fri Aug 05 14:31:09 UTC 2022","24846","chromium","redmine.spec.js","Check clickability of header menu","","","Click  on links of header menu",""
"passed","Tue Aug 09 13:33:23 UTC 2022","Tue Aug 09 13:33:32 UTC 2022","9786","","tests/redmine.spec.js","Check clickability of header menu","","","Click  on links of header menu",""
"passed","Tue Aug 09 13:33:36 UTC 2022","Tue Aug 09 13:33:39 UTC 2022","2736","","tests/redmine.spec.js","Search feature with invalid credentials  ","","","Fill in ""Search"" field: ""***###""",""
